{"schema_version":"1.0.0","session_id":"session_00000000-0000-4000-8000-000000000003","scene_id":"scene_00000000-0000-4000-8000-000000000003","revision_authority":{"kind":"native_device","authority_id":"device_00000000-0000-4000-8000-000000000003","revision_branch_id":"branch_00000000-0000-4000-8000-000000000003"},"scene_revision":0,"world_frame":{"world_frame_id":"world_00000000-0000-4000-8000-000000000003","world_frame_version":1,"coordinate_convention":"RR-COORD-1","authority":"arkit","created_by_frame_id":"frame_00000000-0000-4000-8000-000000000003"},"surfaces":[],"objects":[],"support_relations":[],"placed_assets":[],"edit_history":[],"updated_at_utc":"2026-07-16T00:00:00Z"}
